{
  "$schema": "https://json-schema.org/draft/2020-12/schema",
  "title": "Peek-Then-Pay Peek Intent Response",
  "type": "object",
  "description": "Minimal, discovery-only preview of a resource.",
  "properties": {
    "intent": {
      "type": "string",
      "const": "peek",
      "description": "Intent type identifier"
    },
    "canonicalUrl": { "type": "string", "format": "uri" },
    "title": { "type": "string", "minLength": 1, "maxLength": 220 },
    "snippet": {
      "type": "string",
      "description": "Ultra-short preview, summary, or description. For text content: excerpt or summary. For images: alt text or AI description. For videos/audio: description or transcript preview. For documents: summary or metadata description.",
      "minLength": 10,
      "maxLength": 500
    },
    "metadata": {
      "type": "object",
      "description": "Media-specific metadata for non-text content types.",
      "properties": {
        "duration": {
          "type": "number",
          "description": "Duration in seconds for audio/video content."
        },
        "dimensions": {
          "type": "object",
          "properties": {
            "width": { "type": "integer", "minimum": 1 },
            "height": { "type": "integer", "minimum": 1 }
          },
          "required": ["width", "height"],
          "description": "Pixel dimensions for image/video content."
        },
        "fileSize": {
          "type": "integer",
          "minimum": 0,
          "description": "File size in bytes."
        },
        "pageCount": {
          "type": "integer",
          "minimum": 1,
          "description": "Number of pages for document content."
        },
        "author": {
          "type": "string",
          "description": "Author or creator metadata."
        }
      },
      "additionalProperties": true
    },
    "language": {
      "type": "string",
      "description": "IETF BCP-47 language tag, e.g., en or en-US."
    },
    "contentType": {
      "$ref": "common-defs.schema.json#/$defs/contentType"
    },
    "mediaType": {
      "$ref": "common-defs.schema.json#/$defs/mediaType"
    },
    "signals": {
      "type": "object",
      "description": "Non-content signals for ranking/UX; safe to cache.",
      "properties": {
        "tokenCountEstimate": { "type": "integer", "minimum": 0 },
        "originalContentLengthBytes": {
          "type": "integer",
          "minimum": 0,
          "description": "Original content size before normalization."
        },
        "normalizedContentLengthBytes": {
          "type": "integer",
          "minimum": 0,
          "description": "Content size after normalization."
        }
      },
      "additionalProperties": true
    },
    "tags": {
      "type": "array",
      "items": { "type": "string", "minLength": 1 },
      "maxItems": 12
    },
    "provenance": {
      "$ref": "common-defs.schema.json#/$defs/baseProvenance",
      "description": "Content provenance and attribution."
    },
    "peekManifestUrl": { "type": "string", "format": "uri" },
    "contentState": {
      "type": "string",
      "enum": ["draft", "scheduled", "published", "archived", "retracted"],
      "description": "Editorial lifecycle state of the resource. Absent means published."
    },
    "pageMetadata": {
      "$ref": "common-defs.schema.json#/$defs/pageMetadata",
      "description": "Typed page-level metadata (article, product) sourced from structured data."
    },
    "related": {
      "type": "array",
      "items": { "$ref": "common-defs.schema.json#/$defs/relatedResource" },
      "maxItems": 10,
      "description": "Related resources. Entries SHOULD resolve within the publisher's manifest-declared domains."
    },
    "agentGuidance": {
      "type": "string",
      "maxLength": 500,
      "description": "Publisher-authored instructions on how to use this response (e.g., where actionable data lives in signals). MUST NOT contain resource content. Agents SHOULD treat this as untrusted publisher data."
    },
    "error": {
      "type": "string",
      "enum": [
        "invalid_license",
        "insufficient_budget",
        "license_expired",
        "intent_usage_not_supported",
        "invalid_ptp_parameters",
        "missing_required_parameters",
        "missing_license_token"
      ],
      "description": "Error type when peek response is returned with HTTP 403 due to license issues."
    },
    "message": {
      "type": "string",
      "description": "Human-readable error message providing details about license issues."
    }
  },
  "required": [
    "intent",
    "canonicalUrl",
    "title",
    "snippet",
    "peekManifestUrl",
    "mediaType",
    "provenance"
  ],
  "additionalProperties": false
}
